{"applicationId":"new-idea","captureStatus":"captured-verbatim-public-safe","entries":[{"artifacts":[],"authorRole":"builder","byteLength":81,"capturedAt":null,"id":"original-idea","kind":"initial-idea","language":"und","publicIdentifierAttestations":[],"publicTextUtf8":"Replace this public-safe placeholder with the builder's exact idea before review.","publicationStatus":"public-safe","redactionReason":null,"sequence":1,"sha256":"sha256:3b70b9fb87e29a0e44c01e131703631d5cbe123d9bfe559d94891b415a54c45a","sourceMessageId":null,"supersedes":[]}],"legacySourceRefs":[],"originalEntryId":"original-idea","schemaVersion":"1.0.0"}
